Dorothy Phoenix,Dorothy Phoenix,contact@cloudyheavengames.com,"I am a game developer at my company, Cloudy Heaven Games, and a computer science tutor. Prior to self-employment, I worked for six years as a software developer and tester at IBM and a local startup. ",https://www.linkedin.com/in/dorothy-phoenix-0694a55,@cloudyheavengms,female,Black or African American,,Washington DC,"I initially came from a more formal computer science background. I took AP Computer Science in high school (around 2000, back when it was C++ rather than Java). I studied Computer Science and East Asian Studies at MIT, and then got a second degree in Game and Simulation Programming. For five years, I worked as a software engineer on government projects at IBM. This work included repairing and migrating Flash-based educational courseware to an online Army learning system, and then working on enterprise Java websites for government clients. I worked for a year as a software developer in test for a small startup, writing a bit of C++ code for a modem, as well as doing documentation. Iâ€™ve always been the team member who does writing and documentation; it seems a lot of software engineers donâ€™t want to do that role or are not as equipped. While doing these jobs, I was attempting to work on my own video games on my own time, but not finishing. In 2014 I released a mobile game and started my company, Cloudy Heaven Games. A few months later I left my full-time job to focus on the company. Over the past year, I have been to a few conferences to demo my next game releases. I have also been spending a lot of time focusing on tutoring and teaching, including writing books about how I developer my first game, and a compilation of computer science study tips. I got into computer science because I knew from a young age that I wanted to be involved in game development. I would make my own little instruction manuals for games I made up (this was starting back in the late 80s and early 90s, when video games actually came with paper booklets, rather than an online manual!). I never left home without a game book, or game music, or something related to games. I was pretty much obsessed, and Iâ€™ve found a way to make it into my profession.",Other,Self-employed as a game/software dev and computer science tutor.  Previously worked 5+ years for other companies as a dev.,"CS degree,""Collection of resources (blog posts, books, tutorials, workshops, etc.)"",Online learning platforms",,Gaming,,"T109: Dad, Do I HAVE To? What Game Development Can Teach You About Software Testing and Feedback",Other,"Game screenshots, sample of what a project feedback survey might look like, a sample bug/issue list","After working as a developer for several companies, I decided to take a risk and launch my own independent game development company.  Of course, I knew that there was a huge difference between developing software for a client and a big company, and making games on my own, but I quickly began to appreciate the true magnitude of the difference.

One of the major challenges was that instead of other people telling me what they wanted me to build and getting their stamp of approval on the product, I had to try and figure out what others wanted in a game, and hope that it would stand out from the competition.  When youâ€™re on a government contract, someone at the organization has identified that there is a need for the product youâ€™re building, and theyâ€™re willing to pay for it, sometimes lots of money.  No one â€œneedsâ€ the games that I build, and itâ€™s my job to convince them to download/buy and play them.

As a gamer myself, I understood this concept from the beginning, but it really came to life when I was showing off a game at an expo, and a little boy and his father stopped by my table to see what I had on display.  The father asked the boy if he wanted to play my game, and the boy looked and him, frowned, and said â€œDad, do I have to?â€  Definitely not the best response when a potential player looks at your game!

This story might sound like a great way to kill my excitement about game development, but itâ€™s actually a great lesson learned.  It demonstrates how important it is to get feedback when youâ€™re working on a software project, and how you can use the feedback and testing to make changes when needed.  Possibly more important, it shows that you must be able to take criticism.  In this talk, weâ€™ll discuss how to do these things, whether youâ€™re working on a project for someone else, or developing something on your own.

Lesson 1: Donâ€™t just assume you know what people want, get feedback early.  One of the most difficult experiences is spending months, or even more, working on a project, and then finding out that no one really wants to play it.  Thatâ€™s what happened to me when I released my first game.  It was a pretty quick release (only about 4 months in development), because I was very eager to get my game career started and I wanted the game out by Christmas (it was a Christmas-themed game).  I didnâ€™t show anybody the game while I was making it because being a perfectionist, I was unsure about showing a product before I thought it was up to my standards.  But that was a huge mistake; I still should have at least shown off a prototype, with the understanding that it was nowhere near a finished product.  I could have gotten feedback about some of the weaknesses, and maybe even started to gather a following, rather than releasing the game with no established user-base.  Releasing around Christmas was also probably not the best decision, because lots of other developers were also trying to hit that deadline.  After that experience, I made sure to seek out game expos and other events to get early feedback on my games, even in the prototype phase.

When working for someone else, itâ€™s a little bit easier, because youâ€™ll often have some requirements meetings or other process to determine exactly what will be created.  You can make suggestions, but ultimately, the people paying the bills will be calling the shots, for the most part.

Lesson 2: Watch closely as people test and interact with your product.  Itâ€™s good to be able to release your game to lots of people remotely, like on the internet, but seeing people play it in person is also a very valuable experience.  A lot of times, people wonâ€™t always get back to you with feedback, but in person, you can pick up on their reactions, and often learn things that they might not tell you otherwise.  You can see when and where people are getting frustrated or having trouble, and get a sense for how long people are spending on your software.  If they just walk away after a few minutes, maybe the game is not interesting to them, or itâ€™s too hard.  You can also get a good sense of the demographics that enjoy your game.  I thought my next game was more interesting for children, but I saw some older players that seemed to enjoy it.  And some of the children werenâ€™t as engaged as I thought.  I also learned that a lot of people donâ€™t read instructions, they want a game they can pick up and understand quickly.  Part of that is probably because I was testing on mobile, and mobile players have a different style than those who enjoy more text-heavy and complex games like RPGs or strategy games.

When working for someone else, youâ€™ll often have end users who will be testing the software.  I did a lot of government projects, and we always had people â€œin the fieldâ€ who needed to do acceptance testing.  When I worked onsite, I sometimes sat with the government workers to help them understand the product and see where they had trouble, even if sometimes it was a problem that was out of my scope, such as the worker not knowing how to open a web browser.  But even in that case, maybe a solution would be to just create a desktop shortcut that would take the user right to the web portal product, rather than having to navigate to a website.

Lesson 3: Have a plan for your testing.  Try to have specific areas youâ€™d like feedback on.  Know the possible problems and questionable spots in your project, and places you donâ€™t feel as comfortable about, so that after the event or testing session is done, you have addressed your most pressing feedback needs.  Youâ€™ll probably need more feedback later as well, of course, but at least youâ€™ll be able to put to rest some of your biggest worries.  And if youâ€™ve traveled to an event and spent lots of time and money to be there, you donâ€™t want to waste all those resources, you want to make sure you get the best return on your investment.  One approach that has worked well for me is to bring a printed survey that people can fill out (if theyâ€™re willing), as well as some treats or candy to encourage them to give you some feedback.

This tip can also apply if youâ€™re developing for someone else, but in that case, youâ€™ll have a lot more guidance from the product owner and other stakeholders.  As a developer, youâ€™ll still be able to set much of the agenda for testing, based on what youâ€™ve been working on or fixing, but you might also have a dedicated testing team that comes up with test plans (this last part might be true as well if youâ€™re working on your own project, but with a team).

Lesson 4: Develop a thick skin, and get over your hesitations.  I know it can be hard to put yourself out there and accept criticism, but if youâ€™re serious about putting out a successful project, this is a step you must take.  Iâ€™m probably what most would consider an extreme introvert (even though you might not know it, since Iâ€™m giving this talk), and it can be very draining to sit at a convention table for eight hours, talking to strangers, and resisting my urge to duck into a private room.  And as I said, Iâ€™m a perfectionist, so it is jarring to â€œshow my workâ€ before itâ€™s done.  Hearing a kid basically say that my game is terrible could have been a confidence-crusher, but it wasnâ€™t.  But being a successful game developer is important enough for me to do what I have to, just like helping students and attendees at conference like this as a tutor or speaker is important enough for me.  Getting the feedback will always help me become a better developer and have more success.  And it is cool to see people enjoying my game and other games at these events.  It helps to clarify when my game is a prototype, so that people donâ€™t expect a finished, polished product.  

If youâ€™re working for someone else, youâ€™ll get feedback from the client, but you can also ask your fellow developers and teammates for internal feedback.  You can do code reviews and create test plans.  Just make sure to keep focused and remember that it doesnâ€™t have to be a comment on you as a person or developer.  Even if youâ€™re not as attached to the product itself (it might not be your â€œbabyâ€ as would a creative project of your own), donâ€™t let feedback feel like an attack on your abilities.

Lesson 5: Follow up with the information you learn.  Youâ€™ve spent all that time and work, put it to good use and make changes based on what youâ€™ve gathered.  You might not be able to make all suggested changes (and in some cases, maybe itâ€™s just not the game for some players), but if you can identify your top issues, you can greatly improve your game.  If youâ€™ve found that maybe your game or product appeals to a different demographic or need than you first thought, you might take your product in a different example.  For example, Groupon started out with an entirely different business model than its current incarnation.  Had the company not pivoted based on the observed feedback, it might have gone under.  If youâ€™ve gotten email addresses of contact information for willing testers, be sure to send them your updated product, while explaining what the changes are, and asking for further feedback.  These changes can include bug fixes as well as feature improvements (sometimes you might need to add some suggested features or things that would improve the game, or remove features that donâ€™t seem to be working out).  You can even assign priorities to the noted bugs and feature requests, to help you figure out what your top fixes should be.

I take several game prototypes with me when I go to events, to get an idea of which ones people like the most.  Based on what I saw, I chose to focus on one particular game (a puzzle game called Brain Bouncer) that people really got into, and put on hiatus the game that the little boy didnâ€™t want to play.  In fact, Iâ€™m pleased to report that Iâ€™ve had many cases where people would play Brain Bouncer until they solved all the levels, and people from a wide age-range even came back several times to play the game, and Iâ€™m currently working on a level-editor for the game.","It's not always discussed, but one of the most important software development processes is getting feedback, not just to find bugs, but also to figure out if the product is usable, if people like it, and where the frustration points might be.  Especially if you're doing a creative project or something on your own, you need to make sure that you figure out if your game or product will be a success, and what the possible blocks to success will be.","I want people to have ideas about how they can start getting early feedback on their software projects, how to make sure that they're addressing the most pressing areas, and what to do after they get the feedback.","I want them to feel more confident about how to get feedback.  Often, we get so attached to our projects and ""brainchildren,"" that we don't know how to ask for and accept criticism, and we might not even reach out at all.  But the risk is that we create a product that people don't want (or that won't appeal to our intended target).  I want people to feel better able to take this crucial step of getting feedback early.","I mentioned Groupon in my outline, but I want to find and include more stories about games and software that benefited (or didn't) from feedback, so that people see how the process can play out in the real world.","I'm a game developer who is very passionate about my ideas, but unfortunately, others haven't always shared the same enthusiasm.  I've definitely had quite a bit of feedback, positive and negative, and by getting out there and seeing how people react to my offerings, I've gotten on the right track with a game that people actually seem to enjoy!",,I would need hotel accommodations and a train ticket to and from DC.,15 minutes,D,Talk,,,,,,,,
Aaron Kalin,Aaron Kalin,akalin@martinisoftware.com,Aaron Kalin is an openly queer Site Reliability Engineer who works with DNSimple to maintain their fleet of DNS servers. Aaron is also a very active open source contributor and project maintainer for various projects around servers and software who has been in the industry for over 20 years.,,@martinisoft,Male,White,,"Chicago, IL","I'm an openly queer developer that has spoken at a few conferences and events over the years. I've spoken about very technical things and given lightning talks about how to order drinks at a bar because I was a third generation bar and restaurant owner/manager. I can present fairly complex topics very well, at least that is the feedback I have been given over the years and can provide examples.","Employed in a senior code-related role (CTO, director of engineering, lead dev, etc.)",,"""Collection of resources (blog posts, books, tutorials, workshops, etc.)"",Online learning platforms",,Career,,T110: How to not hide in plain sight,Other,Audience exercises to meet others and introduce themselves to their neighbor,"Beginning:
* Some background about myself and how long I have been a career developer

* Sharing a short and very embarrassing story about my first technical conference and how bad I was at meeting people at the first RailsConf in Chicago

Middle:

* Some ways I changed myself physically and mentally to improve my people skills. Reading books, changing my appearance, writing, and speaking.* Audience exercise to meet their neighbor by introducing themselves and telling the other one cool thing about them. Could be that they love rainbows, ponies, some cool new language, etc.
End:
* Resources in the form of books, meetups to attend, protips on speaking and meeting people","Many developers I have known over the years can struggle with interpersonal skills which can limit their career opportunities. My talk tries to provide my own personal journey and hopefully provide some options and exercises to help them expand their social horizons, even a little bit.",They have met their neighbor during the talk or at least learned one way to help them meet others at the conference in between sessions.,Empowered,Books such as Drive by Daniel Pink and Dale Carnegie's How to Win Friends and Influence People,The last 15 years of my career have been fueled by my desire to improve myself and land myself into new and more interesting projects. It has created benefits personally and professionally so I'd like to serve as an example of how others potentially in my situation can change things with even a little effort.,"I've given a version of this talk as a lightning talk before to tell my story years ago, but I wanted to use the longer format to make it more actionable for attendees so they have a more valuable take away that could help them early in their careers.","If I am selected to speak, my company will provide travel and accommodation.",15 minutes,D,Talk,,,,,,,,
Valerie Sharp,Valerie Sharp,valerie@techbychoice.org,"Valerie Sharp is a technologist who focuses on create user-centered digital experiences as a full-time UX designer & full stack developer. To help spread the finical wealth offered by the tech industry, Valerie founded Tech By Choice, a nonprofit that is working to increase diversity in the tech industry by providing low to no cost events for individuals in protected groups. ",https://www.linkedin.com/in/valerie--sharp/,https://twitter.com/digitalblkhippy,Female,Black or African American,,California,"I am a self-taught developer that has a college degree in Psychology and Art. As a UX designer, having the psychology background made the transition to UX seem as natural as riding a bike, and also helped me with the soft skills required to be a good developer. 

This year marks my 5th year in the technology industry and my first year as a full stack developer. Being in the industry for six years Iâ€™ve experienced some hiccups and bumpy roads along the way. Even when things got hard, I kept moving forward because of the access and opposites a developer salary gave my family and me. 

Knowing the access all filled in the tech industry offered, I been a lot of time and effort helping underrepresented individuals get and stay in tech. Iâ€™ve taught at boot camp, volunteer at local meetups, and recently launched Tech By Choice, a nonprofit to help support more people during their tech journey.",Employed as a full-time developer for over 3 years,,Online learning platforms,,Career,,"T111: 48 Hours to Learn, Build, and Secure the Job",Code samples,,"Beginning 

For the first part of my talk, I will introduce the problems I faced as a code newbie trying to land a frontend developer role with very little to no coding experience under my belt. I give a bit of background about making my decision to switch careers before I finished college, and how multiple interview rejections lead me to create a learning cycle.

Middle 
I explain the learning cycle; Understand the Problem, Discovery & Research, Take Action, and Share.

I apply the learning cycle to a take-home coding challenge that I received as well as figuring out the best way to highlight my ability to learn quickly to show employers I'm the employee they should invest in. To explain how to solve coding problems with the learning cycle I  walk through the steps I took to complete the take-home challenge, and explain how it helped during the interview process. 
End 
At the end of the talk, I could come full cycle and give an intro of what my role is today, and how the leaning cycle helped my not only land the job but excel in my position. I will cover how this cycle has helped me understand how to give better technical demos, and help me build up my soft skills that made the translate into leadership roles a breeze. I will close out by letting people know this learning cycle used in their life to solve big and small problems. ","As a code newbie, it can be hard to find the best way to land your first developer job. After I failed multiple interviews, I found a system that helped me prove my ability to employees as well as boost my confidence which allowed me to land a senior level developer job as a jr developer. ","I would hope the people who come to my talk will feel inspired to find a learning cycle that would help them land their next job, promotion, or give a fantastic technical demo. ","I intend to make everyone feel as if they can apply the learning cycle I created to solve problems in their life, both big and small. I hope they are inspired and motivated to take on their next big task. ","For this talk, I've gone through some GitHub projects and youtube videos to find the best examples of learning material. I will also cover some psychological learning tips to help support my learning cycle.  ","I've recently had a few significant career shifts that have pushed me to move into community leadership roles as well as looking my first senior-level developer position. During this search I kept hitting the same roadblocks I hit when I first entered tech, despite my experience. Although it's been a few years since my last job hunt, I started to experience impostor syndrome which affects my confidence level and my ability to do well in interviews. The one thing that has helped me through all of this was my ability to go back to this learning cycle and use this to help me reach my next goal. ","I've recently had a few significant career shifts that have pushed me to move into community leadership roles as well as looking my first senior-level developer position. During this search I kept hitting the same roadblocks I hit when I first entered tech, despite my experience. Although it's been a few years since my last job hunt, I started to experience impostor syndrome which affects my confidence level and my ability to do well in interviews. The one thing that has helped me through all of this was my ability to go back to this learning cycle and use this to help me reach my next goal. ",I will need some help with a hotel & a flight. ,15 minutes,D,Talk,,,,,,,,
