Name - S,Speaker Name,Email - S,Speaker Bio,LinkedIn,Twitter,Gender,Ethnicity,Ethnicity - Other,Bio.1 - S,Speaker Background,Coding Status,Coding Status - Other,Coding Background,Coding Background - Other,Talk Topic,Talk Topic - Other,Title - S,Talk Elements,Talk Elements - Other,Details - S,Problem,Takeaway,Intention,Research,Pitch - S,Other Details,Bio.2 - S,Talk Length,Track - S,Talk Format,What attendees will make,Background Info,Tools/Resources,Availability,Frequency,Tech,Equipment Needed,Video Link
Anabella Spinelli,Anabella Spinelli,anabellaspinelli@gmail.com,"I've been working in the software industry for over 9 years, slowly making my way from QA to software development. Throughout this time, I've been a self-taught coding student, learning from free online courses, articles and projects I came up with to apply my new skills. About a  year ago I started working as a full-time front-end developer.",https://www.linkedin.com/in/anabellaspinelli/,@deutschevita,"Female, lesbian",Hispanic or Latino,,Barcelona,"I'm originally from Argentina, but I've been living in Barcelona with my partner for the past year or so. I started working as a QA Engineer almost by mistake: I had dropped out of classical music school and I desperately needed a job. While working in the software industry I discovered that I really liked this programming thing and started learning a lot about it using free resources online. Last year, after achieving my lifetime dream of getting a job in Europe, I also got the opportunity to finally step into a developer role and I find that I'm loving it. Not only do I get to code all day, and feel my experiences and best practices become applicable, I find that I also love the social aspect of it: interacting with product owners, designers, business people, etc. And when I thought I had it all, 2018 ended with me giving my first talk ever in a conference. It was a thrilling experience and I found that it was something I want to try to explore more this year.",Employed as a full-time developer for less than a year,,"""Collection of resources (blog posts, books, tutorials, workshops, etc.)"",Online learning platforms",,Career,,T036: Just be yourself: job interviews are nothing but first dates,"None,Other","Demoing doesn't apply much to this talk, but I intend to make it a fun and engaging experience, while also leaving people with interesting stuff to think about.","In this talk I will address an issue that I think newcomers to software engineering really care (and stress!) about: interviewing for a job. In my life I've done a lot of interviewing with very little preparation and, after learning a lot through trial and error, I believe I can share a lot of insights about ""what's really going on"" behind the scenes while you're interviewing, and also share ""mental tools"" and tips that can help people feel better while they're going through interview processes.

I plan to do this by comparing the interview process with being on a first date with someone: both of you want it to smoothly and have a real interest in being there, the fact that the event is happening already is a sign of success, and in the end, whatever happens, you'll both learn something. If you've never interviewed for a job in tech, maybe you have been through something like this and can probably relate to it. In the best case scenario, you'll also get some food for thought for your next first date!

Some of the points that apply to both meetings are:
- Getting invited is already being 50% in. I know it doesn't feel like it, but it really is true.
- You're being evaluated, yes, but you're also evaluating them and seeing if they're a right fit for you.
- Tip: Decide what's the story you want to tell about yourself, make it engaging, work on its narrative.
- Please don't lie! It'll just make you nervous. But be smart about how you present the truth, think: ""I don't know anything about React"" vs. ""I've heard about it and its popularity and I'm curious to give it a try.""
- People love being asked about themselves, prepare some questions beforehand. Asking will give you a deeper understanding about the position while showing them the things you care most about.
- If you feel you're not good enough, put your trust in them. They'll know it if you're the one, they have a lot more context about the job, the team and the company and can identify surely the right fit.
- Rejection is gonna happen: it's most likely not about you. A lot of things can affect this outcome, just reflect on what you learned and use it for next time.

For technical/coding interviews:
- It's totally OK to say ""I don't know that"". Let them explain and show them how fast you can learn and apply new things.
- Speak your thoughts out loud as much as you can. Coding interviews aren't about the code, they're about your thought process, try to explain what you're trying to accomplish and why you're taking a certain path. Turn it into a conversation.

Differences between dating and interviewing (that are to our advantage!):
- It's the recruiter's job to get a hire, use this and let them help you. They want this as much as you.
- There's no being ""too interested"" in them. Express your interest by going the extra mile.
- Usually, your counterpart will do most of the talking and will be driving the meeting, you just need to ride along.

After going through all these examples, I expect the attendees to have a deeper understanding about the inner mechanics of this kind of meeting and walk out with a set of tips, insights and tools to use on their next dat... I mean interview.","The main problem addressed by my talk is dealing with the stress about interviewing for a job in tech, specially if it's the first time you're doing it. I think this will be relevant for Codeland's attendees because the majority of them are starting their careers in software engineering. Even before they feel comfortable with their technical skills, they're often faced with the challenge of standing out in a diverse pool of real (and imaginary) candidates.","My main goal is that they leave with some food for thought about interviewing so that they can bring new meaning to their experiences, past and future. This includes tips and strategies to feel better during interviews, ""mental tools"" to keep the stress at bay and a general sense of increased self-confidence about the whole job selection process.","First of all, I want them to feel empowered. Interviewing for a job can feel very intimidating, but in an industry like ours, the person with the higher ground is usually the candidate. I won't be focusing a lot on this, but I want them to leave with a sense of self-confidence and a toolkit they can use to feel prepared to their next recruiting process.","I'll research talks and articles, not only about interviewing but about dating, socialising, charisma and making friends, looking for tips and general notions that can be applied to both dates and job interviews. I'll also try to get some statistics or insights about what's ""the other side"" like: what are the advices for companies and recruiters. Finally, I'll run my talk's contents by the up-and-coming developers that I know from coaching to see what they find useful and what they struggle with the most.","I don't have a CS degree and I came into this industry by sheer chance. I haven't had a safety net since the first time I got a job and so I had to become better at interviewing without almost any preparation. This meant getting the jobs that I wanted, and also being smart about which job offers to take. I did this through a lot of trial and error and most importantly by reflecting about what interviewing really is about and how to make the most out of it. ","I feel very excited about giving a non-technical talk for new and growing developers. I feel they're often pushed into a lot of the technical stuff and left on their own for the social aspects of their careers. I want this talk to be inclusive, mind-easing and ultimately a fun and interesting experience for us all. ","I might be able to ask my company to support part or all of my travel expenses, but it's something I would need to consult with them if my proposal is accepted. My travel needs would be the flight from Barcelona to NYC and accommodation for myself in the city.",15 minutes,A,Talk,,,,,,,,
Will Klein,Will Klein,will.klein@gmail.com,"Will is a full-stack engineer at Workday and co-organizes the React Denver meetup. He loves sharing what he can with the community, whether its organizing events, giving talks, or mentoring others. He is proud to be a father and husband, and lives on a healthy diet of coffee and ice cream in Longmont, Colorado, USA.",https://www.linkedin.com/in/willklein/,@WillsLab,male,2 or more of the above,,"Denver, Colorado","I grew up having a job since I was 12. I worked several blue collar jobs, doing landscaping, stocking shelves at Target, and working in a machine shop. I did this while working my way through college, but I ultimately dropped out. I wasn't learning anything new, having worked part-time building software for a couple years. I spent the first 4 years of my career without any mentorship (solo dev on at small companies), then sought out a real team where I would grow in 2011. This specific team was a major learning, as I was completely unqualified for the job but turned the interview into a learning opportunity. Asking questions and having a thoughtful conversation created a unique situation where I was hired despite a complete lack of relevant skills! It wasn't until 2013 that I would work with someone with less experience than me! Since then, the roles have flipped and I've been one of the more experienced devs on a team. My learning goals turned into mentorship goals: it's my job to help everyone else learn and master new skills. When I'm not mentoring others directly, I'm advocating or building tools that ease the burden of on-boarding, primarily through linting and custom linting rules. My usual speaking topics are around this and other tooling techniques based in abstract syntax trees. At one point I became a director of engineering and hired a team of mostly newbie developers. I learned a lot from interviewing many talented candidates, in terms of interviewing skills (be kind and have fun!), and ultimately learned in new technical things in these interviews.",Employed as a full-time developer for over 3 years,,Other,"I primarily learn by doing, and it has to be self-directed. I don't absorb it otherwise.",Career,,"T037: Forget the Job, Interview to Learn",Other,Stories and photos of newbie devs who asked great questions in interviews,"I'll start with a story: when I looked for a new job in 2011. I had an interview that bullied me with questions, and I walked away completely crushed. I had another phone interview coming up. That morning, I reviewed the job description: it asked for 5 years of experience and expert level JavaScript skills. I had neither, and tried to cancel the interview. After some encouragement from the recruiter, I gave did it anyway. It seemed like it might repeat the previous interview: a phone screen with a laundry list of technical trivia, and I didn't know the answer to any of it. Instead of shutting down, I got curious, and started asking questions. We spent an hour talking through concepts I didn't understand initially, but given I wasn't trying to get hired, I explored without reservation, interviewing the dev on the other end of the line. They didn't mind, in fact, they were refreshed to have a candid conversation, and took a chance on me.

I'll continue with setting up a game plan for ""interviewing to learn."" I'll tear down the assumption that you need too prove how much you know, and simply be honest about what you understand, and where things get fuzzy. We'll frame the interview as a free opportunity to ask questions of a team of more experienced developers. How priceless is that?! We'll start with how to respond with: ""I don't know, but could we talk about that? What is a (example) closure in JavaScript?"" We'll build on that with actions like taking notes and attempting to repeat back or whiteboard what may be a new concept, turning the interview into a study session. Other actions include asking for more time to interview, or requesting additional interviewing exercises that we may feel more comfortable with, and how a follow up interview is a chance to reinforce and potentially show you've learned things you picked up the last time around. We'll also address how we might take this too far, appearing more naive than we really are, and how to represent our skills appropriately when posing questions.

To wrap up, I'll share another story, one from a newbie developer with an incredible tactic of writing down questions from interviews, doing some research of their own, and then asking future interviewers these questions to hear what they think about a topic (example: what do you think of TDD?). Note: I will ask for permission from this person to have quotes and use their photo in the slides. I'll then finish with last words of encouragement: ""Forget thinking: will I get this job? Instead, think: what will I learn today?"" Shifting this perspective is incredible.","Interviews are scary, even to an experienced developer! They're also something everyone must do, several times in their career. How can we reset our mental game and turn every interview into an incredible opportunity learn new things?","They will turn a stressful situation into an exciting, potentially fun, learning exercise!",Excited to approach their next interview with a totally different mindset.,"I'll conduct interviews with both less and more experienced developers.

Questions for less experienced devs include: what scares you about interviews? What was your worst interview experience? What was your best interview experience? What made you more successful in the positive interviews? What did you learn?

Questions for more experienced devs and hiring managers include the same questions, with some additional questions: Does it ever bother you when an inexperienced candidate doesn't know something? Are you willing to answer their technical questions and teach them something? Have you ever hired someone because they asked good technical questions? Were there things they didn't know? Did that matter to you?","I mentioned this in my outline, but my past experiences interviewing and asking questions were the inspiration for this talk. This is both from the perspective of a job candidate AND the hiring team (as a developer and manager). I specialized for a couple years doing pair programming interviews, partnered with another developer. We retro'd after every interview, not about the candidate, but about OURSELVES and how well we conducted the interview. Did we make the candidate feel comfortable? Did we give them adequate time to think? Did they get stuck? Did we find a way to help them move forward? We were always on THEIR side, and let the technical assessment figure itself out afterwards. Then I spent a year as an engineering director, where my primary job was hiring three teams of mostly inexperienced developers. I got to build on the previous experiences, but had a completely different lens. I also interviewed over the years, again and again, proving out that asking questions and being honest pays off, and learning in interviews at every opportunity.","I love the CodeNewbie podcast and find it extremely valuable as a more experienced developer. I wouldn't attend this conference as someone with experience, but this one topic came to mind as something that might be valuable to this audience. I would do my best to prepare an interesting and actionable talk. I'm happy to receive any support provided, and I'm also happy to help other speakers in any way I can. I've given major conference talks a few times now, and I hosted a Global Diversity CFP Day Workshop the past two years. I love teaching and mentoring others and would do my best to share what I can before, during, and after my this talk.",I would likely need help with flight and hotel. I can request this from my company but I cannot say if it would be approved.,15 minutes,A,Talk,,,,,,,,
Yuen Yim Alice Ching,Yuen Yim Alice Ching,chingyalice@gmail.com,"Alice is the lead engineer on Keita Takahashiâ€™s latest game Wattam. Previously, she spent over 11 years working on game engines at EA, Sanzaru Games, and Google. She has a deep passion for making fun and immersive experiences. One of her biggest goals is to empower artists and designers with better technology.",https://www.linkedin.com/in/aliceching/,@oilaisee,female,Asian / Pacific Islander,,San Francisco bay area,"I'm originally from Hong Kong, and came to the USA to study computer science in undergrad. I studied in Pittsburgh, PA (where I met my husband who's an American) and Ithaca, NY, and ended up moving to the bay area in order to pursue one of my dreams, which is to work in the entertainment industry.

When I was growing up, no one around me, including family and friends, is in the tech space. My father got a computer and that was when I started taking an interesting. I took the traditional path in terms of education, but I didn't completely understand what computer science was before I got my degree -- it is not popular at all amongst women in Hong Kong, but since I was good at math and science, and liked making webpages, it seemed like a decent choice. I played a lot of video games -- again, I didn't know that I could make it my career, until, luckily, a video game company came recruiting at my grad school.

It wasn't until I was working professionally before fully understanding the sexism at work. I've tried multiple times, to no avail, to get promoted. I've talked extensively with my peers, my managers and HR about the state of the industry in terms of diversity. I felt like I've been very lucky in being able to be a part of the industry, so much so that I want to keep pushing it forward and making it more inclusive for everyone.

I am now volunteering for a few different causes, including spending my time as a role model for K-12 girls, and actively hiring diverse people into my organizations and teams. However, I really love my day job as a video games programmer, and would try my hardest to stay in the industry despite encountering a lot of (mostly) unconscious bias along the way. It is my hope that as long as I keep hiring the right people, incentivizing them to stay on, and actively recruiting allies, we will eventually get to a better place.","Employed in a senior code-related role (CTO, director of engineering, lead dev, etc.)",,CS degree,,Other,Coding tips to help people get started as a professional coder,T039: How to work with closed-source API,Other,Demo of debugging and problem-shooting processes,"First, I will explain what closed-source API is, and list a lot of common examples that most people might run into, along with some open-source software and standards for contrast.

Then I will outline one of the problems I've had when working with such an API (e.g. in Unity). I will go through this utilizing a few strategies along the way:

Check all sources of information
- Documentation
- Google search for information
- Forums, bug trackers
- Email the author

Trial-and-error
- Control the input variables
- Try a variety of inputs including base cases
- Use test environments

I will go through another different example of how to use these strategies in a different way.

At the end of the talk, I'll give some suggestions of how can we help improve closed-source API, even if we cannot issue pull requests or fork them.","While working in code, it's often easiest to figure things out when the source code is available and accessible. However, that is often not the case, especially when working with proprietary software or software under an NDA.

This is especially difficult for junior developers as many software tutorials focus on open-source software. I'd like to outline techniques and strategies to help developers get over this difficulty, and even develop their own techniques to troubleshoot any difficult-to-debug API problems.","The audience with come away with a set of strategies they could use to help debugg their code when interfacing with closed-source APIs, as well as learning to identify when a bug is within their own code or within the API, even without source code access.","I hope they can feel empowered and more confident in tackling problems, even if the problems might be difficult and they might fail a few times.",This talk stems from my real-life experience and I will use code snippets from my past and current projects. The references in the talk will be from API documentation from various closed-source and open source software.,"I've been managing and mentoring junior and mid-level engineers, and I've found working with new code to be a common hurdle for a lot of people. In fact, I always feel imposter syndrome when I am lost, trying to debug a difficult problem.

I'd like to talk about how I deal with this, and help people understand that this is not a problem that only junior or new coders have. It's just a set of skill that you can develop over time. Hopefully they will find it inspiring and it will help them be more confident in tackling new or different problems.",,"I do not require any financial help, but I would appreciate if you reallocate this money for a scholarship for another developer in need.",15 minutes,A,Talk,,,,,,,,
Yitzi Ginzberg,Yitzi Ginzberg,hello@yitzi.dev,"Sentence 1: Coder with zero impulse control with regard to building out every crazy idea that flits across my brain.

Sentence 2: CS degree, Certified Systems Analyst with 5 years industry experience.

Sentence 3: I helped a hyrax mom deliver triplets this week!",yitzi.dev/li,@realYitzi - But I just opened it.,male,Prefer not to disclose,,Israel,"Grew up in private Jewish schools where the primary language spoken was yiddish. Going to college was strongly discouraged. 

As a kid I loved computers but as I grew up I forgot about them and pretty much didn't touch a computer between 1995 and 2012.

Married with kids and living in a community where the only respectable lifestyle for a man was to spend all day learning Talmud I suddenly had an epiphany. 

I wanted to be me. I wanted to spend most of my time doing things I wanted to do and not doing things the way others told me they should be done.

I also wanted to be financially self sufficient and have the freedom that a certain amount of money can provide.

I spent 6 months going through text books and watching pretty much every single video on Khan Academy. I then began studying for a CS degree in the Jerusalem College of Technology.

I supported myself as a student first by cleaning houses and later by managing properties. One year before graduation I was recruited by a Software house as an Android developer and I've been working in the field since.

Today I love my life and do not regret any of the decisions I've made. I'm only grateful that I got on this path when I did.","Employed in a senior code-related role (CTO, director of engineering, lead dev, etc.)",,"CS degree,""Collection of resources (blog posts, books, tutorials, workshops, etc.)"",Online learning platforms",,Art/Creative Coding,,T040: API Magic,"Live coding,Demo of working code",,"Beginning: I'm going to show you a trick. I need 10 volunteers. Pick a card any card. I will now demonstrate an Android app I've made that will predict the card that each one of you has chosen simultaneously.

Middle: Trick works. Tremendous standing ovation. Even though magicians are never to reveal their tricks, I'm not a magician, I'm a coder. Here is how I did it..

End: Break past tutorials and ""Best practices"" there is not only one right way. Work on what interests you. Bring your identity to the process. Be fearless.","Lack of creativity. Everyone wants to make an Uber for this or a Google for that. Facebook for christians...

Free yourself to make the things that only you can make.",Begin working on a project that excites them. Not one that seems acceptable.,"Empowered, with permission to create and to fail or succeed being authentic to themselves in the process.",I need to think more about this.,I think the fit is already obvious to you my dear reader from my previous answers.,"I have this weird thing that I can exhale through my eyes. Crazy right?
Nobody believes me until I prove it by blowing bubbles under water.","At my current company I am not in a DevRel position and none of my costs would be covered so I would request coverage of flight and hotel.

I am actively seeking a DevRel position and am in the midst of some very interesting discussions with a few companies. If my status changes and I am in a DevRel position by the time the conference rolls around I will of course update you.

Thanks for taking the time to read this!",15 minutes,A,Talk,,,,,,,,
