Amanda Sopkin,Amanda Sopkin,amsopkin@gmail.com,"Amanda is a Seattle transplant from Denver, Colorado with a great love for coffee and a bit less love for rain. She is a full-stack software engineer for the rentals team at Zillow who attends hackathons as a coach for Major League Hacking in her spare time. She enjoys writing, speaking, and obsessively reading about sharks.  ",https://www.linkedin.com/in/amandasopkin/,,Female,White,,Seattle,"I have been working as a software engineer for a few years. I have worked at a variety of companies, including doing government work before becoming a software engineer for Zillow. I have spoken on engineering subjects a few times before at conferences of varying sizes. I also work as a coach for Major League Hacking, attending hackathons at schools across the country to help students make the most of their experiences. My experience as a coach has taught me a lot about different types of people and the different things they bring to the table as developers. My experience writing, speaking, and doing my job as an engineer has given me unique perspectives I try to share through my writing and speaking. The talk I am submitting is based on my personal experiences and research in these capacities.",Employed as a full-time developer for 1-3 years,,CS degree,,Civic Tech,,T079: Government Technology and What We Can Learn from It,Code samples,,"(Introduction: 2 minutes)
Many developers come to associate government with bureaucracy that it is incompatible with the efforts we take as engineers to ship quickly and work flexibly, but this is quickly changing. Government technologies have their own unique challenges foreign to newer technology companies, including the necessity of ensuring uptime and compatibility with outdated systems. At the same time, while technology companies might struggle to find niche markets where technical solutions do not already exist, many government branches stand to experience rapid improvement with even more basic technical solutions. We will explore the ways that government institutions all over the country are applying technology in novel ways. 
(Smithsonian Digitization: 2 minutes)
The Smithsonian recently took on an initiative to digitize over 137 million artifacts to make them more useful to the public. They successfully completed the effort in 6 months as well as creating a format for completing future transcriptions. The team that took on this project developed a platform for creating digital records from historic files by crowdsourcing volunteers. This format allowed them to get help with the tedious work of transcribing difficult to read but essential historic texts.  This project is fascinating not only because of its historical importance, but because it resulted in the creation of a platform that can be used for other volunteer-based tasks. 
(Opportunity Project: 2 minutes)
In an effort to increase access to valuable tools at lower level branches of government, the Census Bureau recently built out a suite of accessible tools for data processing. The platform, called The Opportunity Project, invites developers and data users around the country to use their applications to complete projects of any scale. The CitySDK makes it easier to build products with open data from the government, designed with compatibility with these kinds of systems in mind. Ongoing projects using the SDK include a tool for sharing data related to the opioid crisis, a platform for connecting veterans to apprenticeships, and a tool for helping businesses and individuals evaluate their disaster preparedness based data on geospatial threats. I will discuss the benefits of creating openly available software geared towards government systems and how this project ensured the adaptability and easy onboarding of the software it produced. 
(Conclusion)
After walking through the unique challenges of building software intended for government use, I will conclude with some takeaways for non-government workers. First, the CitySDK project is a testament to the importance of good documentation for prolonging the life of a piece of software. Second, I will discuss the potential for government projects to leverage citizen volunteers (like the Smithsonian project) and what this means for the tech industry in general. Projects like Mechanical turk or survey monkey rely on usersâ€™ desire to feel useful as well. Finally, we will talk about backwards compatibility and how these projects ensured their own success by building simple systems that can be easily maintained.",As engineers it can be easy to view government technology as antiquated or more slow-moving than the kinds of systems we have grown accustomed to at private technology companies. This is a problem because it causes talented technologists to often rule out government careers that could be meaningful for them.,Attendees will walk away with more knowledge of the ways that government branches are applying sophisticated technology. , I hope the audience will be inspired to research technical government initiatives. , I have done research on successful applications of technology at both the local and national level and will include information about the projects that are mentioned above from this research. I relied upon case studies published on profiles of innovative projects in government to find these projects and conducted further research by visiting the platforms that were created directly.   ,I have worked in government for the Bureau of Land Management and Sandia National Laboratories which is a federal research and development laboratory. Since then I have worked in the private sector for the last few years and often find that my coworkers have misconceptions about the applications of technology in government. I hope to shed some light on the innovative uses of technology in government and the unique challenges that are handled at this level. ,,Flight and hotel,15 minutes,C,Talk,,,,,,,,
Amina Adewusi,Amina Adewusi,amina.adewusi@gmail.com,"Amina Adewusi is a Junior Developer at Error, a remote agency creating websites for the arts and academia sectors in the UK. She taught herself how to code whilst on maternity leave and secured her first junior developer role within three months.",https://www.linkedin.com/in/adewusi/,https://twitter.com/a_adewusi,Female,2 or more of the above,,"London, UK","Amina was born and brought up in London and has a diverse background. She is mixed race - her mum is English and dad is Nigerian and both her parents are Muslims. 

Aminaâ€™s experience as a self taught developer shows that it really is possible to teach yourself how to code and with a basic level of understanding and prove that you are a great addition to a dev team. Amina became really passionate about coding when she learnt about open source. She is excited by the opportunity to connect with people from all over the world to solve important problems. In her spare time she practices meditation.",Employed as a full-time developer for less than a year,,"Online learning platforms,""Collection of resources (blog posts, books, tutorials, workshops, etc.)""",,Career,,T080: Get your first dev job using open source,Other,I'll be showing a variety of real GitHub repos,"Here is a summary of my talk. I include the time I will spend on each section.

00:00: introduce myself and describe my problem and solution
My name is Amina and I am a Junior dev at Error, we are 4 devs and 1 designer working in the arts and culture space using Ruby on Rails! (Cover slide 1)
Last year I started teaching myself how to code, but a lot of the junior dev roles required experience (Slide 2 shows typical junior dev JD requirements) which I didnâ€™t know how to get. 

A mentor suggested I could prove all of these skills through contributing to open source repos on GitHub (Slide 3 GitHub homepage screenshot). This worked for me and now Iâ€™m a strong believer in ensuring open source is welcoming to first time contributors.

In the next 4mins weâ€™ll learn what open source is, go on a journey of the first time contributor and describe the practical tips you need for contributing for the first time! 

00:30: explain GitHub and open source very briefly so everyone in the audience understands
First, letâ€™s explain what open source is, what repos are and give a quick whistlestop tour of GitHub (slide 4 GitHub repo screenshot).

01:00-04:00
30 secs x 6 slides: Key tips on contributing to a GitHub repo for the first time.
Finding the right project - using GitHubâ€™s amazing advanced search function.
Reading the ReadMe 
Installation instructions and how to solve common installation problems
The importance of contribution guidelines
Using issue tags to find the right one for you
How to get help

04:00 summarise the main points Iâ€™ve made

04:30 conclusion
Remind audience of how exciting and empowering open source is
Summarise the key tips Iâ€™ve offered

Remind them of my personal story and how they can follow the same path as me to get their first job by contributing to open source

Finish by offering help to anyone interested and that they can contact me through twitter","This is the story of how I struggled to get my first Junior Developer role and turned to Open Source projects looking for help. Often people who are new to coding donâ€™t know how to get the experience required for their first job. 

Contributing to open source really is the answer to a lot of the requirements asked for in junior dev job descriptions; for example experience using test driven development, putting code into production, undergoing code reviews and writing technical documentation. In this talk Iâ€™ll explain to code newbies and junior devs looking to increase their skillset how to go about using open source projects to do this. 

Iâ€™ll describe what to look for in a repo before choosing which one to contribute to and how to go about doing this to maximise their chances of contributing successfully and creating a great relationship with other contributors and maintainers. Weâ€™ll learn why developers early in their coding journey can struggle to get to grips with a new repo and how attendees can avoid these stumbling blocks.","I want developers early in their career or people completely new to coding to know that engagement with open source projects is an amazing way to improve their skill set and embed themselves in the tech community.

After my talk they will come away with practical tips on what to look for when searching for an ideal repo to contribute to and they will feel confident when starting to contribute to a new repo for the first time. ","After my talk I hope listeners will feel super excited, because they will understand that a whole world of opportunity, learning and people ready and willing to help them - all for free - is available to them. They will know how to search for repos that resonate with their passions or that will provide the best learning experience they need. They will feel empowered to take action and start contributing to open source projects.","I am going to include data from GitHub on the number of open source repos, the number which are active and also the number of issues tagged as appropriate for â€œfirst time contributorsâ€ and â€œhelp wantedâ€. 

I have started interviewing a number of experienced developers about this topic including @EddieJaoude, who is a huge proponent of open source in the UK and one of the top 500 GitHub contributors @torgo, is co-chair of the W3C Technical Architecture Group and sits on the UK Governmentâ€™s web open standards committee. 

I also plan to share my draft presentation with other code newbies to understand different perspectives and experiences of contributing to open source as a new developer.","I live and breathe the life of a first time contributor! I started teaching myself computer programming at the end of last year when I got bored on maternity leave. I got my first dev role in the New Year this year and still feel like Iâ€™m very much at the beginning of my journey. Iâ€™m in a good position to talk about helping first timers, because I am one!

There are an increasing number of people in my position. The dev industry is highly attractive and bootcamps are lowering barriers to entry. Itâ€™s easy to forget what itâ€™s like to know nothing and there arenâ€™t many people on the speaker circuit who are still at the earlier stages of their career. This talk will address that growing audience of new people entering the industry. It will also help those at the ripe stages of their career who have the power to welcome new people into their communities and benefit from increased contribution. 

Public speaking is one of my strengths. Iâ€™m personable, I speak clearly and I know how to respond to an audience. I will be able to deliver my message powerfully and succinctly in the five minutes allotted.

Speakers that look like me are positive for the dev community, because it helps other women and non-white people know that they are welcome and belong here. Itâ€™s also great to have code newbies on the stage, because it sends the message that whatever your level as a developer, you can contribute meaningfully. ",,"Return flights from London, a hotel stay and daycare for my 1 year old who I will bring with me. I am flexible, so very willing to discuss my requirements as it would be a dream come true to be with you all. Thank you so much.",5 minutes (Lightning Talk),C,Talk,,,,,,,,
Loren Klingman,Loren Klingman,lklingman@bignerdranch.com,"I started programming through tutorials and books in middle and high school.  Completed an undergraduate degree, worked for two years, and then came back for my masters.  I was a team lead at Home Depot and am currently a consulting web developer at Big Nerd Ranch.",https://www.linkedin.com/in/lorenklingman,,male,White,,"Atlanta, GA, USA","I'm a fairly senior developer.  Full time for 5 years, but part time for 5+ years during college and high school.  I'm self taught through tutorials and such for almost all my web technologies.  I've worked for companies with tiny (<10 people) IT departments and for Home Depot which has a very large IT department, which has really helped shape my views on testing and code reviews and what things look like with them and without them.",Employed as a full-time developer for over 3 years,,"CS degree,""Collection of resources (blog posts, books, tutorials, workshops, etc.)""",,Career,,T081: What should I test on my front-end?,Demo of working code,,"1. Intro to testing tools/selecting tools that are easy for the reviewer to run after `npm install`
2. Front End Unit Tests - Let's test functions and see how they change state (with working code demo)
3. Front End Unit Tests - Generally not the HTML content
4. Front End E2E Tests - How does this work when it's run in full?  (HTML content) (with working code demo)",Many companies ask for sample code or coding projects and request tests to have been written for the code.  Testing for frontend frameworks tends to be much less straight forward than for backend so this talk will provide a brief overview for testing.,"To take the tools and ideas back to their code and apply them, which will help them write better code and hopefully get better jobs.",Prepared and ready to test their front-end code.,I will include links to the documentation of the various testing frameworks.,"I love helping people succeed in what they are doing and seeing tools improve process.  While working at Home Depot, my fellow developers became my users, and I became passionate about improving the burden of testing code.  This led to diving into front end tests and really considering what we should and shouldn't be testing in each part of that process.",I've also proposed this as a workshop where we would actually write the code for the tests.,"My company generally does not cover travel for speaking at conferences so I will need travel covered.  (Since it's a short flight from Atlanta, I'm happy to fly both ways on Monday to avoid the need for a hotel.)",15 minutes,C,Talk,,,,,,,,
Chris Lorenzo,Chris Lorenzo,chiefcll@gmail.com,"Chris has worked at Comcast since 2007 -- currently as a Distinguished Engineer. He enjoys building/motivating teams and ramping up new projects including XFINITY Home and XFINITY xFi using the latest patterns and web primitives. Besides coding in Javascript, he loves spending time with his wife and two children and helping out in the community.",https://www.linkedin.com/in/chris-lorenzo-3323667/,chiefcll,Male,White,,Philadelphia,I'm your standard privileged white male computer science college grad whose been working as a developer for 15+ years. I've been doing speaking for 3 years and have learned a lot about tech industry. For the last few years my passion is getting new diverse candidates into the tech industry.,"Employed in a senior code-related role (CTO, director of engineering, lead dev, etc.)",,CS degree,,Career,,T082: Getting In and Out of Tech,None,,"Advice on getting into tech from a career change perspective. 
1. Focus on a specific coding language
2. Go to meetups
3. Apply for jobs even if you don't think you are qualified
4. Get feedback and don't be afraid of rejection. Might take 100 interviews to get in.

Once in.
Learn as much as possible - get a mentor, pair program
After a year, GET A RAISE
After two years, apply elsewhere. 
Start learning soft skills (they will increase your career)

Getting out
Working in tech is a lot of work.
Check out the FIRE movement (Financial Independence Retire Early)
Save as much money as you can, live frugally. 
You want to be in a position where you're working because you want to.","Lots of career changers need to hear about how hard it is to get into tech to encourage them to keep trying. Once they are in (which is the hard part) - they need to make sure they are being paid what they are worth. Lastly, you'll get burned out working 80 hours a week all the time. So save as much as you can so you don't have to work forever","Encouraged - excited - able to keep asking for more interviews and breaking into tech. And I want them to be paid what they are worth. Lastly, making lots of money, you need to know what to do with it.",Like a 4 year old who has a banana split ice cream placed in front of them,Tons. If selected I usually spend months prepping and organizing material. Usually my slides contain links to get more details and go deeper on specific things.,I love this topic. I've been hiring career changers - Tech needs more diversity. I've been wanting to talk on this topic for year+,Codeland conf is amazing. I know the quality that you want from your speakers and I'm willing to put in the work to do a great job.,"John Riv and I also submitted a workshop. Hopefully both will get selected and then Comcast will pay for our hotel. I'm submitting this talk as a personal one. So if this is selected alone, I'll need a hotel for the night. Thanks!",15 minutes,C,Talk,,,,,,,,
